{
    "testId": "0001",
    "testDescription": "Test the response time and fault rate of the PetSite application during an AZ disruption",
    "experimentTemplateId": "EXT7zn525j32ff6",
    "steadyState": {
        "metrics": [
            {
                "Id": "m1",
                "metricFormat": "Prometheus",
                "query": "sum(rate(petsite_petsearches_total[2m])) * 60",
                "step": "1m"
            },
            {
                "Id": "e1",
                "metricFormat": "Prometheus",
                "query": "sum(rate(petsite_petsearches_total[2m])) * 60 > bool 100",
                "step": "1m"
            }
        ]
    },
    "hypothesis": "steadyState",
    "lookback": 300,
    "prometheusUrl": "http://10.1.186.117:31793"
}
