{
    "testId": "EXTYy81ZGLGqTUk-66731d7a8a6743cf88ed4c87fdce3d30",
    "testDescription": "Test the response time and fault rate of the PetSite application during an AZ disruption",
    "experimentTemplateId": "EXTYy81ZGLGqTUk",
    "steadyState": {
        "metrics": [
            {
                "Id": "m1",
                "MetricStat": {
                    "Metric": {
                        "Namespace": "AWS/X-Ray",
                        "MetricName": "ResponseTime",
                        "Dimensions": [
                            {
                                "Name": "GroupName",
                                "Value": "Default"
                            },
                            {
                                "Name": "ServiceName",
                                "Value": "PetSite"
                            },
                            {
                                "Name": "ServiceType",
                                "Value": "AWS::EC2::Instance"
                            }
                        ]
                    },
                    "Period": 60,
                    "Stat": "p90"
                }
            },
            {
                "Id": "m2",
                "MetricStat": {
                    "Metric": {
                        "Namespace": "AWS/X-Ray",
                        "MetricName": "FaultRate",
                        "Dimensions": [
                            {
                                "Name": "GroupName",
                                "Value": "Default"
                            },
                            {
                                "Name": "ServiceName",
                                "Value": "PetSite"
                            },
                            {
                                "Name": "ServiceType",
                                "Value": "AWS::EC2::Instance"
                            }
                        ]
                    },
                    "Period": 60,
                    "Stat": "Average"
                }
            },
            {
                "Id": "m3",
                "metricFormat": "Prometheus",
                "query": "sum(rate(petsite_petsearches_total[2m])) * 60",
                "step": "1m"
            },
            {
                "Id": "e1",
                "Expression": "IF(m1 > 0.5, 0, 1)"
            },
            {
                "Id": "e2",
                "Expression": "IF(100 * m2 > 1, 0, 1)"
            },
            {
                "Id": "e3",
                "metricFormat": "Prometheus",
                "query": "sum(rate(petsite_petsearches_total[2m])) * 60 > bool 100",
                "step": "1m"
            }
        ],
        "alarms": [
            "PetSiteOkRate"
        ]
    },
    "hypothesis": "steadyState",
    "lookback": 300,
    "prometheusUrl": "http://10.1.186.117:31793"
}
